post_id,post_date,is_published,email_sent_at,inbox_sent_at,type,audience,title,subtitle,podcast_url
173891324.trump-takes-on-rampant-allegations,2025-09-17T21:59:48.633Z,true,2025-09-17T21:59:48.741Z,2025-09-17T21:59:48.741Z,newsletter,everyone,Trump Takes on Rampant Allegations of Anti-Christian Bias,The Steady State | by Margaret Henoch,
173762653.our-democracy-is-not-stronger-than,2025-09-16T14:42:04.812Z,true,2025-09-16T14:42:04.884Z,2025-09-16T14:42:04.884Z,newsletter,everyone,Our Democracy Is Not Stronger Than Our Divisions,The Steady State | by Martha Duncan,
173589406.us-attack-on-venezuelan-boat-could,2025-09-14T16:35:45.040Z,true,2025-09-14T16:35:45.125Z,2025-09-14T16:35:45.125Z,newsletter,everyone,US attack on Venezuelan boat could set dangerous precedent,"The Steady State | by Andrew Rudman, as published in the Bangor Daily News on September 13, 2025 ",
173531786.how-the-deep-state-doesnt-work,2025-09-13T19:52:22.265Z,true,2025-09-13T19:52:22.359Z,2025-09-13T19:52:22.359Z,newsletter,everyone,How the “Deep State” (Doesn’t) Work,The Steady State | by Greg Rushford,
173517712.dangerous-rhetorica-springboard-to,2025-09-13T15:47:59.399Z,true,2025-09-13T15:47:59.504Z,2025-09-13T15:47:59.504Z,newsletter,everyone,Dangerous Rhetoric...a Springboard to Authoritarianism,The Steady State | by Jaime Ellison,
173516468.fredonia-project-sitrep-17-us-domestic,2025-09-13T15:32:31.035Z,true,2025-09-13T15:32:31.148Z,2025-09-13T15:32:31.148Z,newsletter,everyone,FREDONIA PROJECT - SITREP 17: US DOMESTIC AND NATIONAL SECURITY - SEPTEMBER 11 2025,CABLE ID: 2025-0911 - FRED/WASH/SITREP-017,
173314063.discussion-of-important-stuff-to,2025-09-10T23:30:07.766Z,true,2025-09-10T23:30:07.981Z,2025-09-10T23:30:07.981Z,newsletter,everyone,Discussion of Important Stuff to Know About - The Diplomatic Toolkit: Consistency,A Steady State Firepit Publication | by Charles A. Ray,
173307605.statement-on-the-death-of-charlie,2025-09-10T21:52:54.731Z,true,2025-09-10T21:52:54.890Z,2025-09-10T21:52:54.890Z,newsletter,everyone,Statement on the Death of Charlie Kirk,"The Steady State - September 10, 2025",
173277258.steady-state-letter-to-ssci-and-hpsci,2025-09-10T15:08:59.430Z,true,2025-09-10T15:08:59.540Z,2025-09-10T15:08:59.540Z,newsletter,everyone,Steady State Letter to SSCI and HPSCI,"Concerning the need for intelligence assessment addressing Key Intelligence Questions, September 10, 2025",
173274007.concerning-the-department-of-states,2025-09-10T14:30:11.552Z,true,2025-09-10T14:30:11.698Z,2025-09-10T14:30:11.698Z,newsletter,everyone,Concerning the Department of State’s Promotion of Religion,"Letter to Members of the United States Congress from The Steady State, September 10, 2025",
173223583.donald-trump-and-the-concept-of-power,2025-09-09T22:24:00.482Z,true,2025-09-09T22:24:00.584Z,2025-09-09T22:24:00.584Z,newsletter,everyone,Donald Trump and the Concept of Power,The Steady State | by Tom Wolfson ,
173040252.americas-increasing-vulnerability-11b,2025-09-07T20:20:22.057Z,true,2025-09-07T20:20:22.164Z,2025-09-07T20:20:22.164Z,podcast,everyone,America's Increasing Vulnerability to Russian Intelligence Operations and “Active Measures”,The Steady State | Author's Name Withheld,
172964062.immigration-under-trump-a-moral-and,2025-09-06T17:19:55.619Z,true,2025-09-06T17:19:55.710Z,2025-09-06T17:19:55.710Z,newsletter,everyone,Immigration Under Trump: A Moral and Strategic Failure,The Steady State | by Bruce G. Berton,
172891034.firepit-chats-encouraging-conversation-6fe,2025-09-05T17:05:49.927Z,true,2025-09-05T17:05:50.138Z,2025-09-05T17:05:50.138Z,newsletter,everyone,FIREPIT CHATS - Encouraging Conversation about National Security Issues Important to YOU - The Diplomatic Toolkit: Negotiation ,The Steady State | by Charles A. Ray,
172886581.going-dark-professional-intelligence,2025-09-05T20:16:32.484Z,true,2025-09-05T20:16:32.633Z,2025-09-05T20:16:32.633Z,newsletter,everyone,Going Dark: Professional Intelligence Collection Matters,The Steady State | by Martha Duncan,
172865396.steady-state-calls-for-congressional,2025-09-05T11:19:58.688Z,true,2025-09-05T11:19:58.789Z,2025-09-05T11:19:58.789Z,newsletter,everyone,Steady State Calls for Congressional Inquiry into Laura Loomer’s Role in U.S. Intelligence Community,"September 5, 2025",
172831544.hands-off-the-fed-why-central-bank-6db,2025-09-04T22:58:59.293Z,true,2025-09-04T22:58:59.444Z,2025-09-04T22:58:59.444Z,podcast,everyone,Hands Off the Fed: Why Central Bank Independence Is Vital for Economic Stability and National Security,The Steady State | Bruce G. Berton,
172799144.judge-breyer-issues-injunction-barring,2025-09-04T16:09:46.753Z,true,,,newsletter,everyone,Judge Breyer Issues Injunction Barring Violations of Posse Comitatus Act – Steady State Files Amicus Curiae Brief,,
172706825.distorting-the-human-rights-report,2025-09-03T18:00:21.205Z,true,2025-09-03T18:00:21.312Z,2025-09-03T18:00:21.312Z,newsletter,everyone,Distorting the Human Rights Report Undermines US Strategic Interests,The Steady State | Annie Pforzheimer,
172614326.trumps-america-first-bullying-is,2025-09-02T22:34:52.039Z,true,2025-09-02T22:34:52.165Z,2025-09-02T22:34:52.165Z,newsletter,everyone,Trump’s America-First Bullying Is Turning Enemies Into Allies...And They're Ganging Up On Us,The Steady State | by Charles A. Ray,
172489606.fredonia-project-sitrep-16-us-domestic,2025-09-01T15:34:14.555Z,true,2025-09-01T15:34:14.673Z,2025-09-01T15:34:14.673Z,newsletter,everyone,"FREDONIA PROJECT - SITREP 16: US DOMESTIC AND NATIONAL SECURITY AUGUST 31, 2O25",CABLE ID: 2025 0831-FRED/WASH/SITREP - 016,
172400767.america-first-a-really-terrible-idea-f0e,2025-08-31T13:46:19.093Z,true,2025-08-31T13:46:19.202Z,2025-08-31T13:46:19.202Z,podcast,everyone,"""America First: A Really Terrible Idea that Weakens and Endangers America""",,
172262030.actions-have-consequences-why-im,2025-08-29T14:03:32.235Z,true,2025-08-29T14:03:32.328Z,2025-08-29T14:03:32.328Z,newsletter,everyone,Actions Have Consequences: Why I’m More Worried Now Than at Any Time Since 9/11,The Steady State | Adrian Snead,
172167055.amateur-hour-greenland-operation,2025-08-28T12:31:35.373Z,true,2025-08-28T12:31:35.455Z,2025-08-28T12:31:35.455Z,newsletter,everyone,Amateur Hour: Greenland Operation,The Steady State | by Christopher Burgess,
172100857.arlington-cemetery-and-us,2025-08-27T16:31:17.821Z,true,2025-08-27T16:31:17.959Z,2025-08-27T16:31:17.959Z,newsletter,everyone,Arlington Cemetery and Us,The Steady State by Margaret Henoch,
172001430.america-first-a-really-terrible-idea,2025-08-26T17:02:20.302Z,true,2025-08-26T17:02:20.404Z,2025-08-26T17:02:20.404Z,newsletter,everyone,"""America First”: A Really Terrible Idea That Weakens and Endangers America",The Steady State: by Tom Wolfson,
171758959.blinding-five-eyes-a-self-inflicted,2025-08-23T18:48:42.844Z,true,2025-08-23T18:48:42.916Z,2025-08-23T18:48:42.916Z,newsletter,everyone,Blinding Five Eyes: A Self-Inflicted Wound,The Steady State | by Charles A. Ray,
171672542.tulsi-gabbards-revocation-of-the,2025-08-22T16:49:08.265Z,true,2025-08-22T16:49:08.403Z,2025-08-22T16:49:08.403Z,newsletter,everyone,Tulsi Gabbard’s Revocation of the Security Clearances : A Reckless Action Based on a False Narrative.,The Steady State | Authors' Names Withheld,
171561262.clearance-as-retribution-odnis-weaponization,2025-08-21T13:39:41.343Z,true,2025-08-21T13:39:41.519Z,2025-08-21T13:39:41.519Z,newsletter,everyone,Clearance as Retribution: ODNI’s Weaponization of Access,The Steady State | Christopher Burgess,
171549022.a-letter-to-americas-discarded-public,2025-08-21T10:35:51.859Z,true,2025-08-21T10:35:51.948Z,2025-08-21T10:35:51.948Z,newsletter,everyone,A Letter to America’s Discarded Public Servants: You all deserved better. ,By William J. Burns ,
171427424.in-another-turbulent-time-a-president,2025-08-20T01:07:26.248Z,true,2025-08-20T01:07:26.410Z,2025-08-20T01:07:26.410Z,newsletter,everyone,"In Another Turbulent Time, A President Turned to the National Guard",The Steady State | Margaret Henoch,
171395872.the-steady-state-files-amicus-brief,2025-08-19T18:43:19.637Z,true,2025-08-19T18:43:19.771Z,2025-08-19T18:43:19.771Z,newsletter,everyone,THE STEADY STATE FILES AMICUS BRIEF IN SUPPORT OF CALIFORNIA CHALLENGE TO PRESIDENT TRUMP’S DOMESTIC MILITARY DEPLOYMENT,,
171235507.fredonia-project-sitrep-15-us-domestic,2025-08-18T02:22:18.111Z,true,2025-08-18T02:22:18.207Z,2025-08-18T02:22:18.207Z,newsletter,everyone,"FREDONIA PROJECT - SITREP 15: US DOMESTIC AND NATIONAL SECURITY AUGUST 17, 2O25",CABLE ID: 2025 0817-FRED/WASH/SITREP - 015,
171206652.americas-increasing-vulnerability,2025-08-17T17:39:11.633Z,true,2025-08-17T17:39:11.727Z,2025-08-17T17:39:11.727Z,newsletter,everyone,America's increasing vulnerability to Russian Intelligence Operations and “Active Measures” ,The Steady State | Author's Name Withheld,
171099176.from-lead-to-clean-up,2025-08-16T01:41:17.518Z,true,2025-08-16T01:41:17.598Z,2025-08-16T01:41:17.598Z,newsletter,everyone,From Lead to Clean-up,The Steady State | by Bill Piekney,
171083395.when-trust-is-lost,2025-08-16T12:59:07.077Z,true,2025-08-16T12:59:07.193Z,2025-08-16T12:59:07.193Z,newsletter,everyone,When Trust is Lost,The Steady State | by Greg Rushford,
171081811.fredonia-project-sitrep-14-us-domestic,2025-08-15T20:40:13.644Z,true,2025-08-15T20:40:13.825Z,2025-08-15T20:40:13.825Z,newsletter,everyone,"FREDONIA PROJECT - SITREP 14: US DOMESTIC AND NATIONAL SECURITY AUGUST 13, 2O25",CABLE ID: 2025 0813-FRED/WASH/SITREP - 014,
170994238.steady-state-urges-congress-to-investigate,2025-08-14T18:30:05.993Z,true,2025-08-14T18:30:06.186Z,2025-08-14T18:30:06.186Z,newsletter,everyone,Steady State Urges Congress to Investigate DNI Order Cutting Off Allies from Critical Russia-Ukraine Intelligence,"Letter to Senate Select Committee on Intelligence and House Permanent Select Committee on Intelligence, August 14, 2025 ",
170970396.when-the-past-is-prologue-noriegas,2025-08-14T15:33:17.694Z,true,2025-08-14T15:33:17.813Z,2025-08-14T15:33:17.813Z,newsletter,everyone,When the Past is Prologue: Noriega’s Playbook and Today’s Authoritarian Drift, The Steady State | by Martha Duncan ,
170925075.how-putin-tricked-trump,2025-08-13T21:10:12.217Z,true,2025-08-13T21:10:12.390Z,2025-08-13T21:10:12.390Z,newsletter,everyone,How Putin Tricked Trump,"The Steady State | By Ned Price, as published in Foreign Policy on August 13,2025",
170920334.the-guarantee-clause-shield-or-sword,2025-08-13T20:10:09.418Z,true,2025-08-13T20:10:09.522Z,2025-08-13T20:10:09.522Z,newsletter,everyone,The Guarantee Clause - Shield or Sword?,"The Steady State | by Steven Cash, August 13, 2025",
170907223.the-politicization-of-intelligence,2025-08-13T18:03:21.355Z,true,2025-08-13T18:03:21.499Z,2025-08-13T18:03:21.499Z,newsletter,everyone,The Politicization of Intelligence: Tulsi Gabbard and the Weaponization of Classified Information,"The Steady State | August 13, 2025",
170606576.using-tariffs-as-a-natinal-security,2025-08-10T14:26:50.047Z,true,2025-08-10T14:26:50.143Z,2025-08-10T14:26:50.143Z,newsletter,everyone,"Using Tariffs As A National Security Tool: A Cure-All, Or A Poison Pill? ",The Steady State | By Charles A. Ray ,
170542370.firepit-chats-encouraging-conversation-f1c,2025-08-09T16:14:28.555Z,true,2025-08-09T16:14:28.654Z,2025-08-09T16:14:28.654Z,newsletter,everyone,FIREPIT CHATS Encouraging Conversation about National Security Issues Important to YOU,The Steady State| Margaret Henoch and Dr. Tony Fainberg,
170534145.an-open-letter-to-the-men-and-women,2025-08-09T13:51:58.266Z,true,2025-08-09T13:51:58.374Z,2025-08-09T13:51:58.374Z,newsletter,everyone,An Open Letter to the Men and Women of the FBI from The Steady State Expressing Support and Alarm Over Politicization and Retribution – A Purge,"The Steady State | August 9, 2025",
170467421.what-possibly-could-go-wrong-drones-822,2025-08-08T18:40:47.264Z,true,2025-08-08T18:40:47.378Z,2025-08-08T18:40:47.378Z,newsletter,everyone,"WHAT POSSIBLY COULD GO WRONG? DRONES, MEXICAN CARTELS, AND TRUMP",The Steady State | By Annie Pforzheimer,
170459293.indicators-of-authoritarian-drift,2025-08-08T16:30:36.559Z,true,2025-08-08T16:30:36.698Z,2025-08-08T16:30:36.698Z,newsletter,everyone,Indicators of Authoritarian Drift – Tools for Democratic Early Warning - Part 2 of 2,"The Steady State | August 8, 2025",
170458980.indicators-in-intelligence-analysis,2025-08-08T16:30:30.732Z,true,2025-08-08T16:30:30.836Z,2025-08-08T16:30:30.836Z,newsletter,everyone,“Indicators” in Intelligence Analysis: From Cold War Warnings to Authoritarian Assessment - Part 1 of 2,"The Steady State | August 8, 202",
170457845.firepit-chats-encouraging-conversation-73c,2025-08-08T16:09:37.336Z,true,2025-08-08T16:09:37.526Z,2025-08-08T16:09:37.526Z,newsletter,everyone,FIREPIT CHATS - Encouraging Conversation about National Security Issues Important to YOU - Nuclear Reactors: Controlled Power,"The Steady State | by Margaret Henoch and Dr. Tony Fainberg, August 8, 2025",
170453507.the-steady-state-endorses-rep-eugene,2025-08-08T15:20:32.632Z,true,2025-08-08T15:20:32.833Z,2025-08-08T15:20:32.833Z,newsletter,everyone,THE STEADY STATE ENDORSES REP. EUGENE VINDMAN FOR CONGRESS,"The Steady State | August 8, 2025",
170364006.the-steady-state-responds-to-russia,2025-08-07T14:24:15.367Z,true,2025-08-07T14:24:15.469Z,2025-08-07T14:24:15.469Z,newsletter,everyone,"The Steady State Responds to “Russia Redux”: This Is ""Red Flag"" Evidence of the US Slide Towards Autocracy",The Steady State,
170318478.firepit-chats-encouraging-conversation,2025-08-07T00:21:46.041Z,true,2025-08-07T00:21:46.148Z,2025-08-07T00:21:46.148Z,newsletter,everyone,"FIREPIT CHATS - Encouraging Conversation about National Security Issues Important to YOU - Understanding the Nuclear Realm: Physics, Reactors, Weapons, and the Force","The Steady State | by Margaret Henoch and Dr. Tony Fainberg, August 6, 2025 ",
170304913.we-are-still-on-the-beaches,2025-08-06T20:48:07.208Z,true,2025-08-06T20:48:07.343Z,2025-08-06T20:48:07.343Z,newsletter,everyone,We Are Still On The Beaches... ,The Steady State | Steven A. Cash ,
170258826.the-steady-state-endorses-rear-admiral,2025-08-06T11:44:19.766Z,true,2025-08-06T11:44:19.872Z,2025-08-06T11:44:19.872Z,newsletter,everyone,THE STEADY STATE ENDORSES REAR ADMIRAL EILEEN LAUBACHER FOR CONGRESS,"THE STEADY STATE | August 6, 2025",
170130423.fredonia-project-sitrep-13-us-domestic,2025-08-04T22:37:02.489Z,true,2025-08-04T22:37:02.656Z,2025-08-04T22:37:02.656Z,newsletter,everyone,"FREDONIA PROJECT - SITREP 13: US DOMESTIC AND NATIONAL SECURITY AUGUST 2, 2O25",Cable ID: 2025 0802-FRED/WASH/SITREP - 013,
170099953.the-steady-state-endorses-abigail,2025-08-04T16:16:56.976Z,true,2025-08-04T16:16:57.108Z,2025-08-04T16:16:57.108Z,newsletter,everyone,THE STEADY STATE ENDORSES: ABIGAIL SPANBERGER FOR GOVERNOR OF VIRGINIA,"The Steady State | August 4, 2025",
170025347.manipulating-research-and-science,2025-08-03T19:43:03.154Z,true,2025-08-03T19:43:03.263Z,2025-08-03T19:43:03.263Z,newsletter,everyone,"Manipulating Research and Science Data, Administration Seeks to Toss Lifesaving Greenhouse Emission Standards",The Steady State | by Diane Blust,
170009966.hands-off-the-fed-why-central-bank,2025-08-03T15:58:01.716Z,true,2025-08-03T15:58:01.818Z,2025-08-03T15:58:01.818Z,newsletter,everyone,Hands Off the Fed: Why Central Bank Independence Is Vital for Economic Stability and National Security,The Steady State | Bruce G. Berton,
169938140.weaponized-accusations-hollow-claims,2025-08-02T17:03:32.906Z,true,2025-08-02T17:03:32.991Z,2025-08-02T17:03:32.991Z,newsletter,everyone,"Weaponized Accusations, Hollow Claims: Trump and Gabbard’s Obama “Coup” Narrative Is a Case Study in Political Disinformation",The Steady State | The Steady State,
169935934.today-is-not-normal,2025-08-02T16:44:26.799Z,true,2025-08-02T16:44:26.881Z,2025-08-02T16:44:26.881Z,newsletter,everyone,Today is NOT Normal,The Steady State | By Martha Duncan,
169880605.donald-trumps-wars,2025-08-01T20:36:36.122Z,true,2025-08-01T20:36:36.268Z,2025-08-01T20:36:36.268Z,newsletter,everyone,Donald Trump’s Wars,The Steady State | by Charles A. Ray,
169598694.when-public-power-becomes-a-racket,2025-07-31T16:44:56.452Z,true,2025-07-31T16:44:56.536Z,2025-07-31T16:44:56.536Z,newsletter,everyone,When Public Power Becomes a Racket,What RICO’s Framework Reveals About Allegations of Government Extortion ,
169507117.make-fossil-fuels-great-again-why,2025-07-28T22:33:48.705Z,true,2025-07-28T22:33:48.840Z,2025-07-28T22:33:48.840Z,newsletter,everyone,Make Fossil Fuels Great Again - Why?,The Steady State | by Diane Blust,
169470773.national-security-for-the-dinner,2025-07-28T18:04:31.336Z,true,2025-07-28T18:04:31.432Z,2025-07-28T18:04:31.432Z,newsletter,everyone,National Security for the Dinner Table- The Real Cost of Losing Taiwan,The Steady State | Sergio Fontanez,
169388643.signalgate-update-if-hegseth-cant,2025-07-27T17:48:24.472Z,true,2025-07-27T17:48:24.556Z,2025-07-27T17:48:24.556Z,newsletter,everyone,"SIGNALGATE Update: If Hegseth Can’t Protect Our Secrets, How Can He Protect America? ",The Steady State | Author's Name Withheld,
169336032.the-dismantling-of-usaid-a-major-ca8,2025-07-29T21:55:32.765Z,true,2025-07-29T21:55:32.891Z,2025-07-29T21:55:32.891Z,podcast,everyone,The Dismantling Of USAID - A Major Self-inflicted Injury To US National Security,The Steady State,
169241652.a-steady-state-deep-dive-militarization,2025-07-26T16:31:07.027Z,true,2025-07-26T16:31:07.152Z,2025-07-26T16:31:07.152Z,podcast,everyone,A Steady State Deep Dive - Militarization of our Streets is Unamerican,The Steady State | The Steady State,
169217239.the-dni-under-tulsi-gabbard-a-stark,2025-07-25T11:23:32.359Z,true,2025-07-25T11:23:32.450Z,2025-07-25T11:23:32.450Z,newsletter,everyone,The DNI under Tulsi Gabbard: A Stark Move From Foreign Intelligence to Domestic Intelligence?,The Steady State | Author's Name Withheld,
169170693.dezinformatsiya-meets-americas-magaphone,2025-07-24T20:29:01.569Z,true,2025-07-24T20:29:01.671Z,2025-07-24T20:29:01.671Z,newsletter,everyone,Dezinformatsiya meets America’s “Magaphone”,The Steady State | by Greg Rushford,
169082327.fredonia-project-sitrep-12-us-domestic,2025-07-24T12:41:16.836Z,true,2025-07-24T12:41:16.935Z,2025-07-24T12:41:16.935Z,newsletter,everyone,FREDONIA PROJECT - SITREP 12: US DOMESTIC AND NATIONAL SECURITY JULY 22 2O25 ,CABLE ID: 2025 0722-FRED/WASH/SITREP - 012e,
168988603.fredonia-project-sitrep-11-us-domestic,2025-07-22T20:14:38.920Z,true,2025-07-22T20:14:39.016Z,2025-07-22T20:14:39.016Z,newsletter,everyone,FREDONIA PROJECT - SITREP 11: US DOMESTIC AND NATIONAL SECURITY JULY 13-20 2025,CABLE ID 2025-0713-FRED/WASH/SITREP - 011,
168977793.what-happened-to-marco-rubio,2025-07-22T18:21:00.918Z,true,2025-07-22T18:21:01.086Z,2025-07-22T18:21:01.086Z,newsletter,everyone,What Happened to Marco Rubio?,The Steady State | by Bruce G. Berton,
168953684.the-dismantling-of-usaid-a-major,2025-07-22T15:01:37.799Z,true,2025-07-22T15:01:38.735Z,2025-07-22T15:01:38.735Z,newsletter,everyone,The Dismantling Of USAID - A Major Self-inflicted Injury To US National Security,The Steady State | Mark Goodman,
168858054.the-steady-state-urges-republican,2025-07-21T13:46:50.256Z,true,2025-07-21T13:46:50.398Z,2025-07-21T13:46:50.398Z,newsletter,everyone, The Steady State Urges Republican Senators: “Do Not Look Away” as Trump Undermines U.S. National Security Institutions ,Text of Letter sent by The Steady State today to U.S. Senate Republicans.,
168746200.state-department-cuts-hurt-american,2025-07-19T23:45:07.898Z,true,2025-07-19T23:45:07.975Z,2025-07-19T23:45:07.975Z,newsletter,everyone,"State Department Cuts Hurt American Business, Prosperity and Economic Competitiveness",The Steady State | by Robert Cekuta,
168592772.a-steady-state-deep-dive-the-ghw,2025-07-17T23:12:21.308Z,true,2025-07-17T23:12:21.412Z,2025-07-17T23:12:21.412Z,podcast,everyone,"A Steady State Deep Dive- The GHW Bush Years - Proof That Coherent, Integrated Foreign Policy Decision-Making Is Possible",The Steady State | The Steady State,
168521100.the-trump-administrations-deportations,2025-07-17T17:13:04.528Z,true,2025-07-17T17:13:04.677Z,2025-07-17T17:13:04.677Z,newsletter,everyone,"The Trump Administration’s Deportations Comprise Its Current Africa ""Policy""",The Steady State | by Charles A. Ray,
168406259.fredonia-project-sitrep-10-us-domestic,2025-07-15T17:50:12.534Z,true,2025-07-15T17:50:12.656Z,2025-07-15T17:50:12.656Z,newsletter,everyone,FREDONIA PROJECT - SITREP 10 : US DOMESTIC AND NATIONAL SECURITY JULY 7-13 2025,CABLE ID: 2025-0713-FRED/WASH/SITREP-010,
168291876.july-11-2025-a-sad-day-for-american,2025-07-14T13:35:10.264Z,true,2025-07-14T13:35:10.430Z,2025-07-14T13:35:10.430Z,newsletter,everyone,"July 11, 2025 - A Sad Day for American Diplomacy",The Steady State | by Mark Goodman,
168247463.militarization-of-our-streets-is,2025-07-13T22:46:50.529Z,true,2025-07-13T22:46:50.596Z,2025-07-13T22:46:50.596Z,newsletter,everyone,Militarization of Our Streets is Un-American.,The Steady State | Author's Name Withheld,
168242420.statement-from-the-steady-state-on,2025-07-13T21:12:48.834Z,true,2025-07-13T21:12:48.916Z,2025-07-13T21:12:48.916Z,newsletter,everyone,Statement from The Steady State on the Mass Firing of State Department Officers,"Julyl 13, 2025",
168068569.curtailing-foreign-student-visas,2025-07-11T12:30:14.759Z,true,2025-07-11T12:30:14.840Z,2025-07-11T12:30:14.840Z,newsletter,everyone,Curtailing Foreign Student Visas: Cutting Off Your Nose To Spite Your Face,The Steady State | by Charles A. Ray,
168025981.america-in-a-changing-world,2025-07-10T21:06:38.538Z,true,2025-07-10T21:06:38.621Z,2025-07-10T21:06:38.621Z,newsletter,everyone,America in a Changing World,The Steady State | by Robert F. Cekuta as published in FOREIGN ANALYSIS,
168022483.fredonia-project-sitrep-9-us-domestic,2025-07-10T20:41:00.434Z,true,2025-07-10T20:41:00.558Z,2025-07-10T20:41:00.558Z,newsletter,everyone,FREDONIA PROJECT - SITREP 9 : US DOMESTIC AND NATIONAL SECURITY JULY 1-9 2025,CABLE ID: 2025-0517-FRED/WASH/SITREP-009,
167936811.rethinking-the-military-law-enforcement,2025-07-09T20:09:27.680Z,true,2025-07-09T20:09:27.812Z,2025-07-09T20:09:27.812Z,newsletter,everyone,Rethinking the Military-Law Enforcement Divide: From Army in the Streets to Police as Army,The Steady State | by Steven A. Cash,
167908032.how-it-happened,2025-07-09T14:19:37.322Z,true,2025-07-09T14:19:37.393Z,2025-07-09T14:19:37.393Z,newsletter,everyone,How It Happened… ,The Steady State | By Nate Brought ,
167521828.sliding-into-authoritarianism-the,2025-07-04T14:12:13.109Z,true,2025-07-04T14:12:13.217Z,2025-07-04T14:12:13.217Z,newsletter,everyone,Sliding into Authoritarianism The Indicators Are There For All To See,The Steady State | by Charles A. Ray ,
167480203.a-big-ugly-blow-bub-to-domestic-energy,2025-07-03T22:58:19.551Z,true,2025-07-03T22:58:19.695Z,2025-07-03T22:58:19.695Z,newsletter,everyone,"A Big Ugly Blow (BUB) To Domestic Energy Resilience, Jobs, the Economy and National Security",The Steady State | by Diane Blust,
167370756.dismissing-our-intelligence-collection,2025-07-02T17:25:06.617Z,true,2025-07-02T17:25:06.770Z,2025-07-02T17:25:06.770Z,newsletter,everyone,Dismissing Our Intelligence Collection and Analysis Capabilities Emboldens Our Adversaries ,The Steady State | Martha Duncan,
167294014.the-national-security-act-of-1947-17e,2025-07-01T19:43:38.289Z,true,2025-07-01T19:43:38.381Z,2025-07-01T19:43:38.381Z,newsletter,everyone,The National Security Act of 1947 Meets The Real World ,The Steady State | by Dr. Susan Koch,
167191353.fredonia-project-sitrep-8-us-domestic,2025-06-30T16:42:07.622Z,true,2025-06-30T16:42:07.725Z,2025-06-30T16:42:07.725Z,newsletter,everyone,FREDONIA PROJECT - SITREP 8 : US DOMESTIC AND NATIONAL SECURITY 23-29 JUNE 2025,CABLE ID: 2025-0630-FRED/WASH/SITREP-008,
167163103.post-partisan-america-when-the-game,2025-06-30T09:52:13.032Z,true,2025-06-30T09:52:13.104Z,2025-06-30T09:52:13.104Z,newsletter,everyone,Post-Partisan America: When the Game Stops Making Sense,The Steady State | Steven A. Cash,
167129064.the-national-security-act-of-1947,2025-06-29T20:57:05.464Z,true,2025-06-29T20:57:05.538Z,2025-06-29T20:57:05.538Z,newsletter,everyone,The National Security Act of 1947 and the Disabling of America’s Decision-Making Brain , The Steady State | Steven A. Cash,
167032990.think-that-was-wrong-but-it-has-nothing,2025-06-28T09:55:05.814Z,true,2025-06-28T09:55:05.929Z,2025-06-28T09:55:05.929Z,newsletter,everyone,"Think “That Was Wrong, But It Has Nothing To Do With Me?” Think Again. ",The Steady State | by Tom Wolfson,
166994130.the-west-wing-was-real-life,2025-06-27T18:29:38.097Z,true,2025-06-27T18:29:38.203Z,2025-06-27T18:29:38.203Z,newsletter,everyone,The West Wing WAS Real Life…,The Steady State | by Gail Helt,
166989939.whats-so-bad-about-immigrants,2025-06-27T17:22:43.390Z,true,2025-06-27T17:22:43.478Z,2025-06-27T17:22:43.478Z,newsletter,everyone,What’s So Bad About Immigrants?,The Steady State | by Tom Wolfson,
166932964.a-red-line-has-been-crossed-navigating,2025-06-26T22:34:14.843Z,true,2025-06-26T22:34:14.941Z,2025-06-26T22:34:14.941Z,newsletter,everyone,A Red Line has been Crossed: Navigating the Crossroads of Policy and Diplomacy,The Steady State | Charles A. Ray,
166822707.letter-to-congress-exercise-of-congressional,2025-06-25T16:13:44.256Z,true,2025-06-25T16:13:44.375Z,2025-06-25T16:13:44.375Z,newsletter,everyone,Letter to Congress: Exercise of Congressional War Powers Authority,290 Senior National Security Veterans Call on Congress,
166816113.searching-for-the-trigger,2025-06-25T14:54:54.269Z,true,2025-06-25T14:54:54.376Z,2025-06-25T14:54:54.376Z,newsletter,everyone,Searching for the Trigger,The Steady State | Jonathan Winer as published in The Washington Spectator ,
